id,name,detail
1,โลงศพ,"ชื่อ: สมชาย วัฒนกุล, อายุ: 57 ปี\nภูมิลำเนา: กรุงเทพฯ ประเทศไทย\nสถานะครอบครัว: พ่อเลี้ยงเดี่ยว มีลูกสองคน\nลูกสาววัย 25 ปี กับลูกชายวัย 19 ปี\nอาชีพ: ครูอาสาสอนดนตรีให้เด็กด้อยโอกาส"
2,กีตาร์โปร่งตัวเก่า,"กีตาร์ตัวนี้เป็นเพื่อนแท้ของสมชายมาตลอดหลายปี\nเสียงของมันเคยขับกล่อมลูก ๆ ของเขาในค่ำคืนอันเงียบสงบ\nและเคยเป็นเครื่องมือสร้างแรงบันดาลใจให้เด็ก ๆ ในชุมชน\nความหลงใหลในดนตรีของเขาไม่มีวันจางหาย\nและเสียงเพลงของเขายังคงอยู่ในหัวใจของทุกคน"
3,ถ้วยราเม็ง,"ทุกวันเกิดของลูก ๆ สมชายจะลงมือทำราเม็งด้วยตัวเอง\nเป็นเมนูที่เต็มไปด้วยความรักและความผูกพัน\nไม่ใช่แค่รสชาติที่อร่อย แต่ยังเป็นตัวแทนของความอบอุ่นในครอบครัวของเขา\nอาหารเป็นหนึ่งในวิธีที่เขาใช้เชื่อมโยงกับคนที่เขารัก"
4,ต้นโพธิ์เล็กในกระถาง,"สมชายเชื่อในการเติบโตและความสงบ\nต้นโพธิ์นี้เป็นสัญลักษณ์ของความอดทนและการให้ร่มเงากับผู้อื่น\nเปรียบเสมือนแนวคิดที่เขายึดถือมาตลอดชีวิต\nการเป็นที่พึ่งพิงให้กับผู้ที่ต้องการความช่วยเหลือ\nโดยเฉพาะเด็ก ๆ ที่เขาสอนดนตรีให้"
5,กล่องรับบริจาค,"หากคุณต้องการช่วยเหลือและสนับสนุนครอบครัวของสมชาย\nสามารถบริจาคได้ที่บัญชีของลูกสาว ธนาคารAAA เลขบัญชี 123-456-78\nทุกการบริจาคจะช่วยให้ความฝันและมรดกของสมชายยังคงดำเนินต่อไป\nขอบคุณสำหรับความรักและการสนับสนุน"